{
  "schemaVersion": 1,
  "include": ["docs/**"],
  "exclude": ["docs/private/**"],
  "allowedMediaTypes": ["text/markdown", "text/plain"],
  "allowedProcessors": ["local-markdown", "local-text"],
  "allowedProviders": ["provider:local-whisper"],
  "allowedStorage": ["project-repository"],
  "allowedRegions": ["au-southeast-1"],
  "retentionClass": "project-lifetime",
  "retentionDays": 365,
  "logging": "ids-only",
  "cache": ["principalId", "profileId"],
  "accessClass": "project-members",
  "licenceRestrictions": ["attribution-required"],
  "publication": "internal-only",
  "maxQuoteBytes": 2048,
  "maxFiles": 1000,
  "maxFileBytes": 10000000,
  "maxExpandedBytes": 100000000,
  "id": "policy-internal-docs",
  "dataRightsClass": "internal"
}
