{
  "schemaVersion": 1,
  "include": ["docs/**"],
  "exclude": ["docs/private/**"],
  "allowedMediaTypes": ["text/markdown", "text/plain"],
  "allowedProcessors": ["local-markdown", "local-text"],
  "allowedProviders": ["provider:anthropic/claude", "provider:local-whisper"],
  "allowedStorage": ["project-repository"],
  "allowedRegions": ["au-southeast-1", "us-east-1"],
  "retentionClass": "project-lifetime",
  "retentionDays": 365,
  "logging": "ids-only",
  "cache": ["principalId", "profileId"],
  "accessClass": "anyone",
  "licenceRestrictions": [],
  "publication": "external",
  "maxQuoteBytes": 4096,
  "maxFiles": 1000,
  "maxFileBytes": 10000000,
  "maxExpandedBytes": 100000000,
  "id": "policy-public-docs",
  "dataRightsClass": "public"
}
