{
  "schemaVersion": 1,
  "include": ["docs/**"],
  "exclude": ["docs/private/**"],
  "allowedMediaTypes": ["text/markdown", "text/plain"],
  "allowedProcessors": ["local-markdown", "local-text"],
  "allowedProviders": ["provider:local-whisper"],
  "allowedStorage": ["project-repository"],
  "allowedRegions": ["local"],
  "retentionClass": "engagement-scoped",
  "retentionDays": 90,
  "logging": "ids-only",
  "cache": ["principalId", "profileId"],
  "accessClass": "named-reviewers",
  "licenceRestrictions": ["no-redistribution", "no-verbatim-quotes"],
  "publication": "forbidden",
  "maxQuoteBytes": 0,
  "maxFiles": 1000,
  "maxFileBytes": 10000000,
  "maxExpandedBytes": 100000000,
  "id": "policy-restricted-local-only",
  "dataRightsClass": "restricted-local-only"
}
