{
  "schemaVersion": 1,
  "include": ["docs/**"],
  "exclude": ["docs/private/**"],
  "allowedMediaTypes": ["text/markdown", "text/plain"],
  "allowedProcessors": ["local-markdown", "local-text"],
  "allowedProviders": ["provider:local-whisper"],
  "allowedStorage": ["project-repository"],
  "allowedRegions": ["local"],
  "retentionClass": "project-lifetime",
  "retentionDays": 365,
  "logging": "ids-only",
  "cache": ["principalId", "profileId"],
  "accessClass": "named-reviewers",
  "licenceRestrictions": ["no-redistribution"],
  "publication": "forbidden",
  "maxQuoteBytes": 0,
  "maxFiles": 1000,
  "maxFileBytes": 10000000,
  "maxExpandedBytes": 100000000,
  "id": "policy-confidential-no-publish",
  "dataRightsClass": "confidential"
}
